"5","Подскажите сильно упадет фпс в сравнении f-hd в играх? Видеокарта gtx 780.или она совсем не потянет?"
"5","Монитор построен на хорошей матрице, она выдает сочную картинку, углы обзора широкие и отклик быстрый, даже в самых быстрых сценах все видно замечательно, нет смазываний, порты удобно расположены и подставка тут не хлипкая. как и сама сборка. Большой дисплей тут, смотреть фильмы приятно."
"5","Шикарный монитор с отличными заводскими настройками. Радует поддержка формата QHD, картинка реалистичная, сочная, как живая. Нет потемнений в углах, подсветка равномерная, и бликов не ловит потому что тут матовый дисплей, и своего отражения не видно в экране. Подставка надежная и он не трясется, хоть и экран большой. Менюшка в порядке, все удобно сделано."
"5","Если брать в расчет ценовой сегмент, и отдавать отчет что берешь 25'' с разрешением 1440р - что само по себе значит маленький пиксель, то недостатков нет. Описаных в других комментариях засветов по краям у меня не наблюдается."
"5","продал свой старый монитор LG 24"" с E-IPS матрицей (лет 6 назад был топовым), долго выбирал монитор на замену, я оч. требовательный и переборчивый покупатель и выбрать было непросто, взял потестировать на неделю разрекламированый монитор 27"" Samsung Curved S27D590CS с матрицей *VA, не понравилась медленная матрица и 27' все таки много для мониторов и в целом изображение было ""какое то не такое"" после старого монитора с IPS матрицей, на IPS не такой резкий контраст и более мягкие цвета как мне кажется в сравнении с VA, но зато на VA конечно потрясающий черный цвет. Проанализировал наличие и цены мониторов на IPS и решил заказать AOC. После пару дней тестов понял, что это то - что мне нужно! ПЛЮСЫ: 2к разрешение (изображение оч. четкое), оптимальный размер 25"", гибкие настройки параметров изображения, причем прямо в утилите с возможностью сохранения профилей и быстрым переключением между ними, удовлетворительная скорость матрицы, отличная цветопередача, яркость и контраст (все гибко настраивается), хочу заметить, что цвета в разы более правильные чем на том же Самусунге, что я взял прежде, регулируемая подставка. Из минусов: беда всех IPS - паршивый черный цвет, и приличные засветы по углам монитора, но приходится смериться ибо плюсы перекрывают в разы эти недостатки, даже и не знаю какая альтернатива может быть этому монитору за такие деньги. Некоторые продвинутые юзеры, похоже специалисты по работе с графикой пишут, что в мониторе завалены ""кривые"", неровные градиенты, неравномерность цветовой температуры и т. п, я лично такого не замечаю, не работаю профессионально с графикой, похоже все это они определяют исключительно в диагностических программах, на глаз это все незаметно! для меня все отлично в плане цветопередачи. Однозначно рекомендую монитор как универсальный для дома: игры, кино, серфинг, работа с фотошоп и т п., правда для игр нужна карта минимум gtx970 чтобы комфортно играть с 2к разрешением, но оно того стоит, четкость картинки просто поражает!"
"5","Меня монитор впечатлил. Оптимальный размер матрицы. Отличная детализация. Равномерная подсветка. Цвет радует. Конструкция не хлипкая. Для фотолюбителей - оптимальный вариант. Глаза не устают."
