"5","Рекомендую!"
"4","Монітор толковий, але як на мене краще брати 16х10, цей на 15мм. нищий (висота екрана) за квадратний 19"". Трохи поспішив, все ""вперлося"" в кошти."
"4","сколько ггц в етом мониторе ???"
"4","2 дня как купил..пока все нормально.покупал для xbox 360"
"5","Подключил HDMI Кабель. Монитор гораздо быстрее реагирует (выходит со спящего режима). Теперь почти полностью устраивает. Дело в том что есть один баг или особенность. В настройках поставил галку ""отключить уведомления о подкл. входов"" по моему так называется пункт меню, а информация все равно выскакивает на экране....."
"4","Купил данный монитор (долго выбирал). Что сказать, Картинка супппппер!!! Контраст , яркость , качество сборки на высоте!!!! Но! Поставил 4 из за одного неприятного поведения монитора......... :((( В минусах опишу."
