"4","Что то не ясно с герцовкой. 60 гц или немного актуальнее цыфры в 2к16 ом?))"
"5","Превосходная вещь. Использую, в основном, для работы с текстом. С моей точки зрения, одновременная эксплуатация двух мониторов проигрывает в сравнении, т.к. в этом случае приходится постоянно переключать внимание с одного на другой, да и рамки мониторов будут мешать. Тут же — цельная рабочая поверхность и движений глаз достаточно, чтобы её охватить, если сидеть хотябы в метре от экрана. Пробовал играть в The Witcher 3 — красота, что еще сказать, но железо нужно мощное, чтобы тянуть максимальное разрешение. Рекомендую всем, кто стремится к продуктивной и комфортной работе. Ну и геймерам тоже, конечно."
"4","Покупал не на розетке. Пользуюсь уже больше месяца. Покупал как замену своим двум старым 22 дюймовым, для программирования. Очень доволен покупкой."
"5","Мабуть самий якісний монітор серед своїх аналогів з вигнутими екранами. Купував також не на розетці"
"5","Приобрел данный монитор. Покупал не здесь. Монитор впечатляет. Размер, визуально ощутимая изогнутость, необычное соотношение сторон - это всё в совокупности вызывает вау-эффект! Брал в первую очередь для работы, чтоб заменить дуал монитор конфиг. 34"" 21:9 полностью удовлетворили мои потребности. Пробовал также запускать игрушки. Почти у все наблюдаются те или иные проблемы с поддержкой разрешения 3440х1440. Но, я думаю, со временем ситуация начнет улучшаться. Также чтоб потянуть такое разрешение требуется ТОПовое железо. Моя GTX970 в некоторых играх не позволяла выкручивать настройки на максимум Рекомендую"
"5","Вещь! Ни на грамм не пожалел потраченных денег! Работаю дизайнером аниматором, Были подозрения насчет изогнутого экрана, но картинку не искажает и дискомфорта при рисовании не вызывает."
