"5","Покупал не здесь. Все было отлично. Битых нет, засветки нет. ШИМ не чувствую глазами и не вижу через камеру."
"5","Монитор очень нравится. Очень стильно выглядит за счет своей тонюсенькой рамки. Несмотря на то что видеокарта у меня Nvidia, и многие тут говорят про ограниченный диапазон, цвета без установки расширенного диапазона всеравно суперские. Подключала через HDMI и переходник DVI. Успела поиграть в Биошок Инфинити на полных граф. настройках. Супер."
"5","Монитор бомба. Из-за маленькой рамки такое впечатление будто картинка в воздухе парит (со временем конечно к хорошему привыкаешь, но зразу после большерамочных мониторов - дико). Также понравилось качество изображения, лучшего не доводилось видеть. Конечно после ""тусклых"" цветов ТН-матрицы первое время болят глаза, нужно под себя настраивать. До подключения драйверов и калибровки плевался на качество картинки, болели глаза. Для чтения есть режим - бумага, что очень удовлетворяет мои потребности"
"4","Замечательный монитор. Успел купить еще до скачка доллара, так что доволен на все 100. Подключен через hdmi-кабель и специальный кабелек для того, чтобы работал usb-хаб. В одном из слотов usb у меня стоит блютуз для подключения периферии."
"4","Монитор супер. покупал для игры в World of Tank. Первое время процент побед резко упал. Врагов не вижу любуюсь красотами травкой птичками листой на деревьях. Потом как по привык монитор стал помогать -- высунется из-за пригорка т54 а я ему в лючок болванку--на старом 17 дюймовом я б этот лючок не увидил бы(маленький он- а теперь вижу чётко). задержек с изображнением картинки в бою нет. В ворде очень понравилось две страницы рядом помещаются на экране. Блин классно и очень удобно."
"5","Dell U2414H - отличный монитор. Однако, существует один важный аспект, с которым я сам долго разбирался, а поэтому хотелось бы помочь людям с этим. Дело в том, что с подключением по HDMI (а также по кабелю DVI-HDMI, как было в моем случае) могут возникнуть проблемы неполного цветового RGB-диапазона (вместо полного спектра 0-255 видеокарта передает диапазон 16-235), что происходит из-за определения устройства не как, собственно, компьютерного монитора, а как HDTV-телевизора. Для решения этой проблемы, некоторые советуют включить в настройках контрольной панели видеокарты режим YCbCr, однако, на самом деле, этого делать не стоит! Этот режим не для использования на компьютере, а для подключения медиа-проигрывателей к монитору. YCbCr может помочь с глубиной чёрного цвета, но включая YCbCr, Вы получити иные проблемы - кроме неестественно перенасыщенных некоторых оттенков еще и плохое качество градиентов (плавных переходов из цвета к цвету), так как режим YCbCr использует сжатие для каждого пиксела. Чтобы получить отличную, насыщенную и контрастную картинку с глубоким чёрным цветом надо включить режим RGB и разрешить видеокарте использовать полный диапазон. Владельцам видеокарт от AMD в этом плане повезло - они могут просто включить правильный диапазон в настройках (показано на этом скриншоте: http://img841.imageshack.us/img841/3144/59103413.png ). Я являюсь владельцам видекарты Nvidia, и, к сожалению, производитель за долгие годы так и не удосужился встроить переключатель диапазона RGB в панель управления своих карт (судя по записям на форумах в интернете, проблема неполного диапазона при подключении мониторов к их видеокартам по HDMI существует еще с 2009 года). Поэтому, владельцам Nvidia нужно самостоятельно решать имеющеюся проблему, и на данный момент существует три способа ее решения: 1. Самый простой способ, который скорее всего вам поможет, - использовать специальную утилиту, которую можно скачать по этой ссылке: http://blog.metaclassofnil.com/wp-content/uploads/2012/08/NV_RGBFullRangeToggle.zip Запустив ее, просто нажмите ""Set Full Range (0-255)"" и после выполненых программой действий перезагрузить компьютер. 2. Если первый способ Вам не помог, как было, например, в моем случае, можно попробовать в ""Панели управления Nvidia"" создать пользовательское разрешение экрана (как это сделать показано на этом видео: http://www.youtube.com/watch?v=NPIbtgngquk ). Однако, этот способ не для всех подойдет, так как не все полноэкранные приложения (например, игры) работают с пользовательскими разрешениями. К тому же, этот способ у меня тоже не сработал - никакие манипуляции с созданием пользовательского разрешения не включали полный диапазон RGB в моем случае. :( 3. Третий способ, наверное, наиболее сложный для простых пользователей, однако лишь он мне помог. Его суть заключается в том, что надо внести правку в реестр Windows, добавляя туда новый определенный параметр. Для этого откройте редактор реестра (Кнопка ""ПУСК"" -> ""Выполнить"" -> прописать там ""regedit"") и пройти там поочередно окрывая папки по пути HKEY_LOCAL_MACHINE\SYSTEM\CurrentControlSet\Control\Video. Там будет несколько папок такого, к примеру, вида: {B3B96AF6-4AF0-4B38-829A-9638013A0239}. Нужно открыть каждую из них и найти ту, в которой существует ""раскрываемая"" (с ""плюсиком"" слева) папка ""0000"" (сами папки ""0000"" есть в каждой из них, но не все ""раскрываемые""). Найдя такую ""раскрываемую"" папку надо нажать на ней правой кнопкой мыши и выбрать в меню ""Копировать имя раздела"". Далее, нужно создать файл (например, через Блокнот) с таким содержимым: REGEDIT4 [HKEY_LOCAL_MACHINE\SYSTEM\CurrentControlSet\Control\Video\{B3B96AF6-4AF0-4B38-829A-9638013A0239}\0000] ""OverrideEdidFlags0""=hex:10,AC,A4,A0,00,00,FF,FF,04,00,00,00,7E,01,00 Т.е. всего три строчки. Во второй строчке подставьте Ваше значение, скопированное из редактора реестра (обратите внимание, что оно должно быть в квадратных скобках ""["", ""]""). Третья строчка - это значение параметра именно для данного монитора Dell U2414H, так что ее не надо менять если у вас эта модель. После этого, не забудьте сохранить файл с расширением .reg и, запустив его и получив сообщения о внесении информации в реестр, перезагрузить компьютер. Если после перезагрузки диапазон так и не поменялся, попробуйте аналогично для других ""раскрывающихся"" папок ""0000"" в реестре по вышеуказанному пути, если они есть. Монитор официально не имеет драйверов для Windows XP, возможно поэтому у меня и возникли проблемы с первым способом. Не вдаваясь в технические подробности, советую всем, кто хочет использовать этот монитор на Windows XP использовать сразу третий способ, так как остальные два в моем случае не помогли. Я потратил на выяснение выставления полного диапазона RGB для моего случая (Windows XP, видеокарта Nvidia) почти неделю, так что, надеюсь, что этим сообщением смогу помочь Вам сразу использовать на полную этот отличный монитор, а поверьте, он того стоит - качество изображения полного RGB 0-255 просто на голову выше по сравнению с ограниченным RGB 16-235 или YCbCr. :) PS: Мой экземпляр даже после включения полного слегка зеленил (было заметно на серых тонах), но, судя по отзывам в том числе иностранных обзорщиков данного монитора, это распространенное явление. Поэтому, для себя я выбрал пресет ""Custom Color"" (если кто не знает, он выбирается через само меню в мониторе в пункте ""Color Settings"" -> ""Preset Modes"" и позволяет настроить насыщенность отдельных цветовых каналов) и настроил R:99, G:90, B:98. Сейчас монитор радует отличной контрастностью и честной цветопередачей отображаемой картинки, а также лишь очень небольшой засветкой по углам, что очень редко для современных мониторов."
"5","Монитор стильный, приятный. Настроек лишних нет (типа разгона матрицы). В играх глюков, артефактов, шлейфов и задержек мной не наблюдается. Цветовая схема ""игровая"" выстроена таким образом чтобы было равномерно видно все от ярких сцен до темных (гамма), при этом яркость не регулируется, только контрастность, стоит динамическая контрастность. При этом абсолютного черного нет, слегка серый. Если играть то не напрягает, напрягает когда об этом размышляешь. Эта игровая схема непривычная (не натуральная) но эффективная (все видно в разных по темноте сценах). Режим ""чтение"" дает повседневную комфортную работу. Для фотографий режим - ""мультимедия""."
