"4","Монитор хороший, но все же я немножечко с ним намучался, надеюсь вам это поможет. Сразу говорю, что полный цветовой диапазон (0-255) у меня влючен, даже при подключении через display порт, проблема с цветовым охватом уже давно решена с обновлением драйвера видеокарты. Несколько фактов о пресетах монитора: 1) В настройках монитора я изменил гамму с PC на MAC, так как в режиме ПК гамма слишком тусклая. Я обратил внимание, что некоторые цветовые режимы (пресеты) работают в определенном режиме гаммы. 2) Пресет sRGB работает в режиме MAC и если изменить его на ПК - это ничего не даст. sRGB красным оттенком отдает. 3) Пресеты Медиа и Игра работают в режиме ПК и соответственно изменить это тоже нельзя, цвета чуть более насыщенные, но максимальная яркость заметно ниже. 4) Пресет Игра позволяет добавлять насыщенность цвета. Только у него можно включить Динамическую контрастность (которую лучше выключить, так как в играх на темных сценах, например в меню паузы, яркость очень сильно падает и текст инвентаря в игре хуже читается). 5) Пресеты Стандарт и Пользовательский работают в обоих режимах гаммы! Может показаться, что пресет Пользовательский ярче Стандартного, но это не так. Пресет Стандартный просто более ""постепенно"" меняет яркость и в конечность счете достигает такой же максимальной яркости как и пресет Пользовательский. 6) Пресет Пользовательский позволяет вручную изменять каждый цвет отдельно (красный, зеленый, синий). 7) Все остальные пресеты вообще странные, зачем они нужны не понимаю, один слишком желтит, другой синевой отдает. В общем, я выставил режим гаммы MAC и пресет Стандартный, но гамма немного ""сьедает"" цвет, а поскольку насыщеность цвета можно добавить только в пресете Игра, а сам этот пресет работает только в режиме ПК (в котором занижена гамма), то в настройках видеокарты решил добавить насыщеность цвета (цифровая интенсивность до 60%). Или же выберите пресет Игра и в настройках видеокарты добавьте гамму примерно до 1.15. Можно добавить насыщеность цвета в настройках монитора (пресет Игра позволяет это сделать) или настройках видеокарты. Многие его сравнивают с U2417h, но я выбрал u2414h поскольку о этом мониторе есть много обзоров и он более проверенный многими пользователями. Но все же разница есть между ними - у U2417h используется PLS матрица от самсунг, а у U2414h AH-IPS матрица от LG. Так же в модели U2417h есть 2 usb порта, которые расположены сбоку экрана, что более удобно, подробнее можете прочитать из обзора на tftcentral. Скорей всего через пару лет U2417h будет более популярен и провенр, но на данный момент о нем мало что известно, поэтому я предпочел U2414h, так как он на рынке уже давно и хорошо себя зарекомендовал среди пользователей. В целом, монитором я более чем доволен, рекомендую к покупке."
"4","Вообще отличный. Пользуюсь 3 года примерно +/-"
"5","Годнотейший монитор за свою цену. Глаза от него Абсолютно не болят. Ни мерцания, ни кристалич эффекта, подлагиваний, ничего такого. Смело берите. По цветам и смотрибельности, пришел к таким настройкам: 1) Standart 30 Яркость 75 Контраст. 2) ColorTemp 6,5k 30-75. Для работы-игр достаточно. Остальные режимы дают искажение цветов, даже хваленый srgb) В целом, монитором я очень доволен. Безрамочный дизайн просто супер, картинка как бы парит в воздухе, в общем одно ощущение легкости бытия, при работе с данным монитором. Рекомендую=)"
"5","Подключил к ноутбуку lenovo g505s через hdmi. Очень нравиться качество картинки и цвета поярче чем на ноуте. Теперь никаких проблем если целый день сидишь за компом. Правда у себя не нашел как растянуть картинку полностью (думаю проблема видеокарты) - сейчас вижу 2 мм черную полоску по краям (визуально будто рамка не 2 мм а 5 мм). Но такое если ставлю расширение HD, а если ставлю режим дубликации экрана ноута и монитора, то с расширением 1368*768 тонкой черной полоской не видно но все на экране огромное. Итого могу только посоветовать этот монитор тем кто много сидит за компом и хочет качественную картинку"
"5","Користуюсь даним монітором вже 18 місяців, тільки позитивні враження. Єдине про що шкодую, через 4 місяці після покупки, вийшов u2715h, абсолютно аналогічний цьому, тільки 27 дюймів, і 2560х1440, і тоді був дорожчий не на багато, якби на той час обоє були б в наявності - взяв би інший. А так - усе прекрасно."
"5","Все устраивало пока не начал мерцать."
"5","Отличный монитор для дизайна: цветопередача отличная, тонкая настройка яркость/контраст, приятные, добротные материалы! Никаких засветов/мерцаний и т.д. Глаза не устают после трех часов работы (больше пока не сидел). Проблем с полным спектром RGB не было, т.к. на родных дровах от gtx 750 ti есть настройка, включающая отображение диапазона 0-255. Так же на карте есть miniDisplayPort, так что проблем с кабелем нет, включил - работай! Единственный нюанс с USB хабом - расположен не очень удобно, если монитор стоит близко к стенке, то подключать устройства не очень удобно."
"5","доволен"
"3","Купил данную модель проработала дней 15 Все норм как для меня цветопередача углы обзора ,засветов почти нету НО уже не работают сенсорные кнопки.. вообще большой недостаток именно кнопки тупят по черному еще на первый день покупки через раз нажимались думал отвезти на обмен но потом все заработало да и лень было .. и что делать ...Может кто сталкивался ??"
"4","При подключении через HDMI до окна приветствия WIndows монитор пишет сообщение ""Нет сигнала"". У кого стоит пароль на BIOS или другие средства защиты, монитор так и будет писать ""Нет сигнала"". Для того что бы на мониторе отобразилось окно пароля нужно первый раз стартануть с 2 мониторов. После перезагрузки проблема пропадает."
"5","Был приятно удивлен качеством изображения, ожидал что будет хуже"
"5","Классный моник, в качестве режима отображения выбрал sRGB т.к. стандартный отдает фиолетовым оттенком"
"5","тонкий, яркий, качество сборки на высоте рекомендую"
"5","Я доволен этим монитором, подходит как и для работы, так и для игр! Подключен через HDMI кабель, видеокарта NVIDIA MIS GTX 970 Gaming 4g , в играх все замечательно, возможно иногда изображение плывет в роликах из-за медленного отклика матрицы/низкой частоты развертки.. но это очень редко и в пару только игр... больше брал для работы.. меня все устраивает вполне за такую низкую цену он себя оправдывает всецело!"
"5","Хороший монітор за помірну ціну, брав для фото."
"5","Хороший монитор, проблем никаких."
"5","работает уже год, нареканий нет. могу вам рекомендовать!"
"5","Подключили по HDMI - DVI, проблем с RGB не обнаружено. Монитором довольны!"
"4","Отличный монитор! Рекомендую! =)"
"5","Стоит купить."
"5","Монітор просто шикарний. Кольори насичені. В комплекті є дуже корисне програмне забезпечення що дозволяє розділити екран не декілька секцій і ""прикріпляти"" вікна в них. Плюс можна різним програмам встановити різні режими роботи - поставив для браузер Paper і читати тепер саме задоволення. В хаб запхав клаву, мишку, + э вихід на аудіо - можливо можна і колонки в нього увімкнути, требуде спробувати. Одним словом бомба а не монітор. Але для любителів динамічних ігор таких як Quake online - не раджу брати - практично не можливо грати. А для решти підійде."
"5","Брав в першу чергу для роботи з текстами. Відображення тексту в режимі ClearType і кольори значно кращі ніж в старому Samsung 961BF на TN матриці."
"4","Достался такой монитор, на замену любимому Samsung 971P. Впечатления неоднозначные. Однозначно по сравнению с PVA матрицей указанного самсунга, чёрного цвета у этого Делла вообще нет. Он какой то серый, вобщем не то к чему привык. Далее, смена изображения в зависимости от угла обзора, к чему тоже не привык. Но это исключительно индивидуальные впечатления и сила привычки. IPS однозначно будут проигрывать по таким критериям *VA матрицам, так что это просто дело привычки. Теперь о плюсах: картинка сочная, насыщенная, внешний вид самого монитора выше всяких похвал. Пикселей нет, засветы тоже по сравнению с другими такими мониторами минимальны (видимо удачный экземпляр). В принципе для дома неплох, если переходите с TN, то разница в лучшую сторону будет колоссальной."
"5","Луттший в своем классе."
"5","Рекомендую придбати цей прекрасний і стильний монітор Монитор 23.8"" Dell UltraSharp U2414H Black. Повірте не пошкудуєте. Тому що його простота і шикарно виготовлений дизайн порадують. Що ще говорити. Простота і приголомшлива якість цього монітора порадують. Особливо тих хто не може відірватись від ігор. Якість гри буде просто супер."
"5","Пользуюсь два мес. Делл - есть Делл. Запакован был капитально. В коробке распечатка-чек конкретно данного монитора с конкретным серийником. Дефектов не было. В коробке был кабель для miniDisplayPort, но нет HDMI (!). ШИМ не чувствую глазами и не вижу мерцания через камеру. Из коробки уже настроен идеально, но руками нужно включить FullRGB на видео карте. Драйвер моника обновлялся уже, экранное меню русскоязычное с нормальным переводом, приятное тач-управление. Круть в общем, я доволен. Оптимален по цене/качеству, если не более."
"5","Качество,дизайн,все на высшем уровне.Брал в основном для games,картинка на мой взгляд PERFECTO.Много говорить о данном товаре не стоит,(почему?)Да потому что,просто надо покупать и наслаждаться. Сам купил и очень доволен."
"5","Монитор отличный! Цвета яркие, сочные и контрастные. Очень порадовал дизайн. Тонкая рама вокруг монитора выглядит очень изящно. Работать за монитором одно удовольствие, угол обзора почти 180 градусов, ощущение будто смотришь на лист бумаги а не на экран. Не заметила ни засветок ни Glow эффекта, все просто отлично! Порадовал монитор так же множеством портов, USB 3.0, HDMI, DP. Так же этот монитор с заводской калибровкой цветов."
"5","Я как любитель всей техники с экраном, который занимает большую часть девайса, этим моником очень доволен. IPS матрица на высоте, как всегда"
"4","Непоганий варіант за свої гроші,дизайн вражає."
"5","Отличный моник. Если ваша видяха имеет Display Port и бюджет позволяет - берите."
"4","Был такой монитор на предыдущей работе. Для работы более чем достаточно, в игрушки не игрался - не скажу ничего. В соцсетях тоже удобно висеть. =)"
"5","Брал монитор еще в феврале. Подключен через HDMI. За 3 месяца работы явных проблем не обнаружено. Из того что есть: пляски с бубном для вывода всего диапазона RGB, DVI разъем бы пригодился, не удобное расположение USB портов, небольшой глоу эффект и завсветы по углам, но заметно только если поискать их, в работе не мешает и глаз их не цепляет. Плюсов заметно больше: качество картинки, отсутсвие ШИМа, и как результат - не болят глаза даже при работе по 10-12ч. в день (глаза адаптировались за 1-2 недели), безрамочный дизайн и качество материалов, удобная подставка и регулировка по высоте. Монитор в целом очень хороший за эту цену, можно его рекомендовать."
"5","Монитор просто отличный! Цвета яркие, сочные и контрастные. Очень порадовал его современный стильный дизайн. Тонкая рама вокруг монитора выглядит очень изящно. Работать за монитором одно удовольствие, угол обзора почти 180 градусов, ощущение будто смотришь на лист бумаги а не на экран, чего не могу сказать про модель U2312HM, которая стоит в офисе рядом, там глаза устают больше и быстрее. Не заметил ни засветок ни Glow эффекта, все просто отлично! Порадовал монитор так же множеством портов, USB 3.0, HDMI, DP. Так же этот монитор с заводской калибровкой цветов."
"5","В первую очередь хочу выразить благодарность работникам ""Розетки"". Это единственный интернет-магазин, который не отказался работать с Крымом. Перед этим мне отказали 3(!) интеренет-магазина - не буду их называть. И только в ""Розетке"" нашли простой выход - отправили заказ службой ""Міст Експрес"" вместо ""скисшей"" ""Новой почты"". Кстати, доставка наложенным платежом к подъезду дома обошлась аж... в 35 грн вместо 80 грн ""Новой почтой""! Теперь о мониторе. Покупал потому, что на имевшемся ранее ""Samsung T220"" грейдинг делать просто невозможно. У меня установлена программа ""LutCurve"" для приведения гаммы упомянутого монитора хоть в какое-то удобоваримое состояние - чтобы лица людей не приобретали ""трупный"" оттенок. Так вот, с новым Dell-ом чтобы привести тестовые изображения ""LutCurve"" в порядок, мне потребовалось в мониторе включить пресет sRGB, отрегулировать яркость и контрастность. И всё! Помнится, настраивал знакомому фотографу NEC EA232WMi - так пришлось гамма-кривые править (правда, результат был отличным). А здесь ничего не надо! Дизайн монитора просто поражает воображение. Особенно в сочетании с интерфейсом последних версий программ от Adobe. Прекрасная чёткость, шрифты воспроизводятся великолепно. Этот монитор умеет ""рисовать"" свет. Это не умел делать предыдущий на TN-матрице (их бы запретить по какой-нибудь международной конвенции, как искажающие реальность :). Свет был просто белым пятном (с печалью вспоминал о способностях в этом плане электронно-лучевых трубок). А здесь солнце в кадре доставляет эстетическое удовольствие. Одним словом, отличный монитор, особенно учитывая его стоимость."
"5","Отличная модель с AH-IPS матрицей, которая является самой новой из представленных на рынке. Много писать не буду. Мне попался хороший образец с минимальными засветами в углах экрана (это не редкость в современных мониторах на данном типе матрицы). Да, была проблема с настройкой полного диапазона RGB, т.к. изначально при первом подключении динамический диапазон был 16-235 (это наблюдается буквально со всеми видеокартами nVidia). На офф. сайте \ на форуме (любом посвященному этому вопросу) можно найти ответ как лечить эту болячку с драйвером видеокарты. Данная болячка тянется с 2009 года. Заключение: Монитор полностью оправдывает свою цену, если не свыше. Совет: Надо брать"
"5","Купил, пользуюсь. Монитор классный. Четче и сочнее, чем мой прошлый ViewSonic VA2216w. С ноутбуком lenovo z580 через HDMI работает отлично (под ubuntu 13.10 кстати)."
"4","Пользуюсь неделю , первые дни вообще дико , после старого TN глаза болели первые дни просто ужастно !уже думал назад здавать,но сейчас уже получше , думаю ещё недельку и привыкну Проблем с подключением и настройками - никаких не было , подключал проводом miniDP>DP что в комплекте , наверное проблемы только с HDMI Очень нравится дизайн и качество цвета , прям налитая картинка, непонравился только черный цвет и темные сцены в фильмах (когбудто на мониторе пленка защитная и от этого эффект ""тумана"" на черном цвете) Вертится \крутиться \ изгибается во все стороны что немаловажно если менять положение работы за компьютером Минус не то что бы минус , на ножке жесткое резиновое покрытие (т.е монитор по столу не подвигаешь без жесткого трения резины о стол) сразу подложил коврик от мышки ибо двигаю его часто Монитор очень хорош и определённо стоит своих денег"
