"5","Отличный монитор с ""ретина"" матрицей (185 ppi). После калибровки цвета очень хорошие. Проблем с подключением через дисплей порт нет, в комплекте кабель дисплей-порт -> минидисплей-порт, есть оба вида входа так что можно подключать к видеокарте у которой хоть мини хоть полноразмерный дисплей-порт выход. Есть юсб3 хаб но разьёмы расположены так что пользоваться ими невозможно - один на задней панели, добраться до него можно только сзади, если вставлять флешку нужно держать корпус монитора чтобы он не повернулся; два других разъёма расположены совсем под крышкой в них можно воткнуть только что-то стационарное. Качество картинки просто отличное, текст выглядит как напечатанный, и на 24-х дюймах это очень здорово. Эффекта кристализации нет, углы обзора хорошие, фиолетового свечения нет, но есть хорошо заметный ""глоу"" еффект (правда это на всех ипс матрицах). Равномерность подсветки средней паршивости, но заметно только на полностью чёрном экране. При офисной работе скорость матрицы нормальная, видимых тормозов или артефактов не замечал. Как по мне, главный недостаток этого монитора - это дизайн. Серебристая оконтовка ни к селу ни к городу, подставка просто чудовищная на вид, вообще, монитор сзади выглядит в разы лучше чем спереди. Пока, учитывая цену, конкурентов у монитора просто нет."
"5","Питання до всіх хочу монітор для Ігор чи потягне його відеокарта амд радеон рх 56 Вега і скільки фпс видасть при Макс налаштуваннях в сучасній грі і чи достатньо буде частоти 60 герц . Бо я хочу саме щоб був 4к монітор чи шукати з вищою частотою."
"5","Монитор супер! Цвета хорошие. Регулировка по высоте на высоте! USB не пользовался."
"5","Выбирал между этим и аналогичным 4к, но 27"". Хотел взять что-то ""навырост"", но обуревали сомнения относительно размеров. В итоге подзапарился и вырезал оба макета в натуральную величину и понял что 27 будет слишком большим для моего стола. Плюс у 24ки плотность пикселей выше. В итоге заказал этот и крайне доволен покупкой. Из неприятного заметил, что если поставить ноут, а прямо за ним этот монитор, то вайфай на ноуте пропадает, видимо экран (ололо) ЭКРАНИРУЕТ. Потому просто поставил его сбоку и теперь всем доволен."
"3","часто после сна, не просыпается. Помогает выдернуть вилку питания. Иногда очень напрягает. Да и еще на коробке и самом мониторе разные серийные номера. В талон записали с коробки."
"4","Использую MacBook Pro 15"" для работы с IDE и консолью, фактически с текстом. Раньше использовал внешний монитор 23"" fullHD, но по сравнению с дисплеем MacBook очень плохая картинка и глаза быстро уставали. Купил вот этот Dell сегодня. Качество картинки отличное, но главное, без проблем заработал с MacBook Pro Retina 15"" 2015 года БЕЗ дискретной видеокарты на 60Гц! Автоматически установился scaling aka 1920х1080, но при делании можно и максимальное поставить. Кабель использовал комплектный. Пока нареканий на работу нет. Второй монитор тоже оставил, подключён тоже через thunderbolt, переходником на VGA, и тоже fullHD. И не топовый Макбук без проблем тянет все это дело."
"5","Покупал этот монитор как второй для макбука с ретиной. Покупкой очень доволен, картинка великолепная."
"5","Отличный монитор с ""ретина"" матрицей (185 ppi). После калибровки цвета очень хорошие. Проблем с подключением через дисплей порт нет, в комплекте кабель дисплей-порт -> минидисплей-порт, есть оба вида входа так что можно подключать к видеокарте у которой хоть мини хоть полноразмерный дисплей-порт выход. Есть юсб3 хаб но разьёмы расположены так что пользоваться ими невозможно - один на задней панели, добраться до него можно только сзади, если вставлять флешку нужно держать корпус монитора чтобы он не повернулся; два других разъёма расположены совсем под крышкой в них можно воткнуть только что-то стационарное. Качество картинки просто отличное, текст выглядит как напечатанный, и на 24-х дюймах это очень здорово. Эффекта кристализации нет, углы обзора хорошие, фиолетового свечения нет, но есть хорошо заметный ""глоу"" еффект (правда это на всех ипс матрицах). Равномерность подсветки средней паршивости, но заметно только на полностью чёрном экране. При офисной работе скорость матрицы нормальная, видимых тормозов или артефактов не замечал. Как по мне, главный недостаток этого монитора - это дизайн. Серебристая оконтовка ни к селу ни к городу, подставка просто чудовищная на вид, вообще, монитор сзади выглядит в разы лучше чем спереди. Пока, учитывая цену, конкурентов у монитора просто нет."
"3","Неприятным удивлением было в том, что в комплекте не идет HDMI кабель"
