"5","Dell U2414H - отличный монитор. Однако, существует один важный аспект, с которым я сам долго разбирался, а поэтому хотелось бы помочь людям с этим. Дело в том, что с подключением по HDMI (а также по кабелю DVI-HDMI, как было в моем случае) могут возникнуть проблемы неполного цветового RGB-диапазона (вместо полного спектра 0-255 видеокарта передает диапазон 16-235), что происходит из-за определения устройства не как, собственно, компьютерного монитора, а как HDTV-телевизора. Для решения этой проблемы, некоторые советуют включить в настройках контрольной панели видеокарты режим YCbCr, однако, на самом деле, этого делать не стоит! Этот режим не для использования на компьютере, а для подключения медиа-проигрывателей к монитору. YCbCr может помочь с глубиной чёрного цвета, но включая YCbCr, Вы получити иные проблемы - кроме неестественно перенасыщенных некоторых оттенков еще и плохое качество градиентов (плавных переходов из цвета к цвету), так как режим YCbCr использует сжатие для каждого пиксела. Чтобы получить отличную, насыщенную и контрастную картинку с глубоким чёрным цветом надо включить режим RGB и разрешить видеокарте использовать полный диапазон. Владельцам видеокарт от AMD в этом плане повезло - они могут просто включить правильный диапазон в настройках (показано на этом скриншоте: http://img841.imageshack.us/img841/3144/59103413.png ). Я являюсь владельцам видекарты Nvidia, и, к сожалению, производитель за долгие годы так и не удосужился встроить переключатель диапазона RGB в панель управления своих карт (судя по записям на форумах в интернете, проблема неполного диапазона при подключении мониторов к их видеокартам по HDMI существует еще с 2009 года). Поэтому, владельцам Nvidia нужно самостоятельно решать имеющеюся проблему, и на данный момент существует три способа ее решения: 1. Самый простой способ, который скорее всего вам поможет, - использовать специальную утилиту, которую можно скачать по этой ссылке: http://blog.metaclassofnil.com/wp-content/uploads/2012/08/NV_RGBFullRangeToggle.zip Запустив ее, просто нажмите ""Set Full Range (0-255)"" и после выполненых программой действий перезагрузить компьютер. 2. Если первый способ Вам не помог, как было, например, в моем случае, можно попробовать в ""Панели управления Nvidia"" создать пользовательское разрешение экрана (как это сделать показано на этом видео: http://www.youtube.com/watch?v=NPIbtgngquk ). Однако, этот способ не для всех подойдет, так как не все полноэкранные приложения (например, игры) работают с пользовательскими разрешениями. К тому же, этот способ у меня тоже не сработал - никакие манипуляции с созданием пользовательского разрешения не включали полный диапазон RGB в моем случае. :( 3. Третий способ, наверное, наиболее сложный для простых пользователей, однако лишь он мне помог. Его суть заключается в том, что надо внести правку в реестр Windows, добавляя туда новый определенный параметр. Для этого откройте редактор реестра (Кнопка ""ПУСК"" -> ""Выполнить"" -> прописать там ""regedit"") и пройти там поочередно окрывая папки по пути HKEY_LOCAL_MACHINE\SYSTEM\CurrentControlSet\Control\Video. Там будет несколько папок такого, к примеру, вида: {B3B96AF6-4AF0-4B38-829A-9638013A0239}. Нужно открыть каждую из них и найти ту, в которой существует ""раскрываемая"" (с ""плюсиком"" слева) папка ""0000"" (сами папки ""0000"" есть в каждой из них, но не все ""раскрываемые""). Найдя такую ""раскрываемую"" папку надо нажать на ней правой кнопкой мыши и выбрать в меню ""Копировать имя раздела"". Далее, нужно создать файл (например, через Блокнот) с таким содержимым: REGEDIT4 [HKEY_LOCAL_MACHINE\SYSTEM\CurrentControlSet\Control\Video\{B3B96AF6-4AF0-4B38-829A-9638013A0239}\0000] ""OverrideEdidFlags0""=hex:10,AC,A4,A0,00,00,FF,FF,04,00,00,00,7E,01,00 Т.е. всего три строчки. Во второй строчке подставьте Ваше значение, скопированное из редактора реестра (обратите внимание, что оно должно быть в квадратных скобках ""["", ""]""). Третья строчка - это значение параметра именно для данного монитора Dell U2414H, так что ее не надо менять если у вас эта модель. После этого, не забудьте сохранить файл с расширением .reg и, запустив его и получив сообщения о внесении информации в реестр, перезагрузить компьютер. Если после перезагрузки диапазон так и не поменялся, попробуйте аналогично для других ""раскрывающихся"" папок ""0000"" в реестре по вышеуказанному пути, если они есть. Монитор официально не имеет драйверов для Windows XP, возможно поэтому у меня и возникли проблемы с первым способом. Не вдаваясь в технические подробности, советую всем, кто хочет использовать этот монитор на Windows XP использовать сразу третий способ, так как остальные два в моем случае не помогли. Я потратил на выяснение выставления полного диапазона RGB для моего случая (Windows XP, видеокарта Nvidia) почти неделю, так что, надеюсь, что этим сообщением смогу помочь Вам сразу использовать на полную этот отличный монитор, а поверьте, он того стоит - качество изображения полного RGB 0-255 просто на голову выше по сравнению с ограниченным RGB 16-235 или YCbCr. :) PS: Мой экземпляр даже после включения полного слегка зеленил (было заметно на серых тонах), но, судя по отзывам в том числе иностранных обзорщиков данного монитора, это распространенное явление. Поэтому, для себя я выбрал пресет ""Custom Color"" (если кто не знает, он выбирается через само меню в мониторе в пункте ""Color Settings"" -> ""Preset Modes"" и позволяет настроить насыщенность отдельных цветовых каналов) и настроил R:99, G:90, B:98. Сейчас монитор радует отличной контрастностью и честной цветопередачей отображаемой картинки, а также лишь очень небольшой засветкой по углам, что очень редко для современных мониторов."
"5","Купил несколько дней назад себе это чудо. Был такой на прошлой работе, даже два было. Это просто супер монитор особенно если их 2, так как тонкие рамки позволяют максимально комфортно использовать его в паре или даже больше. Так же радует разнообразие колличества интерфейсов, но почему то не поставляют в комплекте с HDMI кабелем который нужно заказать отдельно (если вы не хотите подключаться через Display Port или его просто нету в вашем девайсе). Плавный поворотный механизм позволяет удобно настраивать расположение экрана. Монитор доставили меньше чем за сутки (Киев). Без цырапин, битых пикселей и прочего, чего можно опасаться.. Хотя это скорее всего лотерея. Однозначно доволен покупкой!"
"4","Брал монитор на замену Dell S2440L (глянцевый) на этот раз хотелось взять именно матовый. Монитор мне нужен для работы с графикой. Эта модель заинтересовала качественной цветопередачей (пространства sRGB), обилием интерфейсов подключения и конечно же дизайном. Должен признать монитор хорош во всем: битых пикселей не нашлось, мне также попался экземпляр с минимальным засветом черного фона по углам и равномерной подсветкой (могу предположить, что новые модели выпущенные позже немного лучше в этом плане, мой экземпляр был 2016 года выпуска), НО то ли это брак, то ли особенность модели мне попался дисплей с тонким (ну совсем еле заметными) вертикальными полосами между примерно каждыми двумя пикселями.(особенно заметно на картинках со сплошным фоном одного цвета) До этого с матрицами IPS не сталкивался (s2440l c матрицей MVA), решил проверить у знакомых - нигде больше не встретил подобное, даже в мониторах намного дешевле. Мне как дизайнеру интерфейсов это жутко бросалось в глаза, поэтому пришлось вернуть. Благо процесс возврата на Розетке отличный и быстрый."
"2","Від 2000-го року мав більше десятка різних моніторів і кінескопних і LCD. Такого жахливого монітора ще не мав, як цей. Я проофесійно займаюся обробкою фотографій. Не знаю, може усі IPS монітори не придатні для фото, а може тільки ця модель. Це перший у мене IPS. Кольори на порядок гірші чим у TN+FILM. Як не старався і я і спеціалісти фотолабораторії, а підстроїти кольори під фотодрук не вдається. Фотографії всі відображаються занадто світлими. Якщо у настройках монітора скручую яскравість до 20-30% (по замовчуванні 75%) то пропадає контраст і насиченість. Все стає асвальтно сірим. Замість чорного кольору у ньому дуже світо-сірий, ще й засвітка у правому нижньому куті. Не раджу саме оцю модель для професійної фотографії. Він набагато гірше від моніторів з TN матрицею, хоч у нього кут огляду гірший, зате є чорний колір і все підстроюється як потрібно. Може набирати тексти у ворді і дивитися фільми на ньому можна з успіхом, але для фотографії він не підходить однозначно!"
"5","#мояраспаковка Отличный монитор с множеством дополнительных вспомогательных функций (USB 3.0 Hub, 2хHDMI, miniDisplayPort и 2хDisplayPort). Экран поворачивается в любую сторону в любой плоскости! Чёткая и яркая картинка с Full HD - разрешением ''радует'' глаз. Дизайн в стиле Dell добавляет ''строгости'' и элегантности. Качество товара - на высоте. Рекомендую для ценителей отличного качества и строгого дизайна."
"5","Опыт использования: 3 дня Монитор оставил преимущественно приятные впечатления. Хорошее качество изображения ""из коробки"" благодаря заводской калибровке. Благодаря большой диагонали создается эффект погружения в работу/фильм/игру. Фильмы, в частности, выглядят как в кинотеатре, ровные, приятные и в то же время насыщенные цвета, хорошая контрастность изображения и отсутствие эффекта ""размазывания"" изображения в динамичных сценах. Текст читается приятно, хоть и не так комфортно как после retina-дисплеев. У монитора хорошие углы обзора и совсем легкий эффект искажения цветов даже при работе с очень близкого расстояния. Порадовало наличие большого количества предустановок для различных сценариев использования (sRGB, Movie, Game, Paper и т.д.). Режимы Movie и Game задействуют динамическую контрастность, т.е. монитор меняет яркость в зависимости от освещенности сцены. Время реакции монитора на сцены в этих режимах приемлемое. Матовое покрытие оставляет двойственные ощущения, с одной стороны, оно выглядит очень хорошо и не создает заметного кристаллического эффекта, но с другой стороны, на мой взгляд, с глянцевым покрытием контрастность и насыщенность цветов могла бы быть немного лучше. Монитор управляется с передней панели за счет сенсорных кнопок и в целом они удобны в использовании. Первая и вторая кнопка настраиваемые, можно вынести часто используемые функции, например, предустановку режима или выбор определенного входа. Также можно отключить индикатор питания при включенном мониторе - мелкий, но приятный момент. Питание USB-портов отключается при отключении монитора кнопкой Power, но присутствует опция для включения питания при режиме standby. USB-порты с током 2A, что удобно для быстрой зарядки планшетов и смартфонов прямо от монитора. Присутствует 3.5 мм разъем для внешнего источника. Удобно для подключения акустики или наушников. Разъем находится на задней части монитора рядом с остальными разъемами. Громкость регулируется на источнике, в мониторе нет отдельного регулятора. К сожалению, в процессе использования ""вылез"" битый зеленый сабпиксель в нижней части экрана (монитор покупался в другом магазине). Гарантия Dell покрывает такие случаи только если битых сабпикселей 6 или более. Такие пиксели называются ""dark pixel"", потому что они выглядят как черные точки на экране. Если битый пиксель ""яркий"", т.е. он горит постоянно вне зависимости от картинки на экране, то по гарантии достаточно наличия одного. P.S. В мониторе есть удобный встроенный режим проверки матрицы, который вызывается зажатием первой и четвертой сенсорных кнопок. После перехода в этот режим по нажатию на четвертую кнопку монитор показывает серую, белую, красную, зеленую и синюю заливку экрана, а также отображает заводской текст. Очень удобно для проверки монитора при покупке."
"5","Отличный монитор, не пойму почему так хейтят его. Качество картинки после древнего LG (жк) просто наслождение. Размер для игр и работы то что надо. Простая регулировка по высоте, наклону и повороту. Множество настроек, для здающих людей будет что подкрутить) Первое время пришлось мудрить с подключением ибо обычного vga и dvi нет, подключил по hdmi через переходник, потом после приезда новой видеокарты использовал родное DP, качество картинки не изменилось как некоторые пишут. Из некритичных минусов - плохая отзывчивость сенсорных кнопок и невозможность зафиксировать ровно по центру ножку когда крутите по бокам, там только на глаз)"
"5","Здравствуйте. Подскажите пожалуйста, хочу монитор взять с функцией Flicker Free,но тут ее нет. Но по отзывам читаю что глаза не устают от этого монитора из за того что он матовый и отсутствует ШИМ. Брать этот монитор или искать какой то другой с Flicker free? Какой производитель посоветуете?"
"3","Заводская калибровка очень плохая, от слова совсем, изначально очень желтит и зеленит. На настройку ушло несколько дней. Я убрал стандартными настройками 10 пунктов красного и 20 пунктов зеленого, теперь в RGB у меня 90 80 100. Яркость сделал 50, заводская была 75. Контраст оставил заводской 75. И еще пришлось использовать стороннее программное обеспечение для настройки. После этих манипуляций, картинка меня полностью устраивает, и он лучше моего прошлого монитора, определенно. Если у вас нет времени и знаний для настройки, и нужна картинка сразу из коробки, покупать не рекомендую."
