"5","Я его взял 2 недели назад, нравится огромный дисплей и разрешение full hd , матрица хорошо настроена еще с завода, углы обзора широкие и все отлично видно со сторон, отклик быстрый , и все здорово даже в самых быстрых сценах игровых, красивые цвета, глубина цвета в норме."
"5","Пока монитор нравится, взял 2 недели назад, надеюсь не повылазят косяки, отличная картинка, хороший баланс цвета, глубина черного, углы обзора широченные, со сторон просматривается все здорово, без инвертирования цвета. Покрытие не ловит бликов, оно матовое, отклик вроде в порядке тоже. Мне нравится. сделан не криво, подсветка в норме и пока без единого битого пикселя"
"2","После того, как написал первый отзыв, нашел еще 2 битых черных пикселя, один такой-же как и три предыдущих, а другой какой-то непонятный, он виден только на синем фоне – так что качеством у philips-а с моим экземпляром как-то не задалось, зря переплачивал, очень жаль."
"5","Монитор стоит своих денег. формирует картинку очень хорошего качества, и подсветка не кривая, на таком мониторе и играть и лазать по нэту комфортно, менюшка гибкая и навигация удобная тут. Никаких бликов нету, поверхность матовая же, да и своего отражения не видно, дисплей большой, на таком смотреть видео даже с друзьями можно."
"5","Каждый день за монитором сижу часов по 6, фильмы редко смотрю, но все же бывает ,а вот играю частенько, ну и по работе тоже много моментов есть. Покрытие матовое, подсветка равномерно распределена равномерно, углы обзора широкие, и со сторон все отчетливо видно, без искажения цвета. Ну считаю, что за свои деньги вариант годный, бюджетная модель"
"5","Монитор появился не так давно у меня и приятно с ним работать, сборка впорядке, углы обзора широкие, и со сторон картинка просматривается отлично, поверхность экрана матовая и не ловит бликов, подсветка равномерная и не убивает глаза,отклик мгновенный и размытости экрана в быстрых сценах нету. Подставка надежная, как и сама сборка монитора."
"5","Мне нравится этот монитор за свою картинку и цену в первую очередь, не думал, что возьму такой хороший монитор за копейки. Экран большой, на нем все четко видно в динамичных сценах, детализация хорошая в общем. Подставка кажется слабой, но нормально держит монитор, точнее ножки а не подставка. И сборка монитора хорошая, для фильмов и игрушек годится"
