"3","Монитор отличный. Самое то для игр, фильмов и программ типа автокада."
"4","Всё нравится кроме минусов."
"5","Покупкой доволен. Рассматривал ищё lg, но цена филипса все решила так как характеристики схожи. Картинка просто супер как в интернете так и в играх. Индикатор маленький и светится белым- на ночь не нужно отключать. Советую покупать."
"5","пользуюсь около 5 месяцев, доволен. но если взять знаменитую версию Монитор 23"" Dell UltraSharp U2312HM Black (который стоил 5 мес назад 1750грн), то это монитор барахло! разницы в качестве изображения и отклика не видно, но в его ""внутрености"" и "" скелете"" разница колосальна!!! тем у кого нету денег, тоесть много денег, и хочется экран не давящий на глаза, покупайте данный аппарат!"
"3","Мон конечно выглядит круто, но по факту качество исполнения на троечку с натягом. Щели в корпусе, тонкий пластик и т.д. Еще блок питания порядком напрягает издаваемым писком. Кто-то пробовал использовать не родной блок питания? можно ли сделать что-либо с родным, что бы он перестал пищать?"
"4","Вопрос к владельцам данного монитора - у Вас наблюдается довольно ощутимый засвет в левой нижнем углу монитора ? Если бы не это - поставил бы пятерочку, а так немного напрягает (скорее морально, но все же)."
"3","Впринципе неплох, НО. Как не старался настроить, но картинка холодная, отдает зеленым.. По борльшому счету мне это не сильно важно, я брал его для фильмов и стандартной работы, но если вы плотно работаете с цветом, то лучше подыскать другой вариант."
"5","За такие деньги придраться не к чему, картинка для игр и кино отличная."
"5","Картинка БОМБА! Все красиво,ярко. Есть только нюанс когда с яркого на темный цвет или наоборот переходит замедленно как-то,но в этом есть большой плюс,при просмотре в темноте глаза не режет."
