"5","Пользуюсь чуть меньше недели и все еще не могу привыкнуть. До этого был монитор от Самсунг 24"" FHD, визуально той же серии, так как похожи. Рабочего места стало больше это большой плюс. Но с рекомендованным масштабом текста 150% (рекомендованный) очень сложно работать, пришлось увеличить до 175%. Очень многие картинки на сайтах стали рыхлыми и мутными, большая часть интернета стала рыхлой и мутной. Понимаешь что еще не подготовили мир сети для экранов 4К. Подключен через выход видеокарты Asus PCI-Ex GeForce GTX 1050 Phoenix 2GB GDDR5 (128bit). Понравилась дополнение ""Easy Setting Box"" может запускаться автоматически при каждом открытом приложении или при перемещении окна разбивает экран разметкой которую вы заранее задали. Делит экран на 2, 3, 4...отдельных секторов, что-то похоже на обзор камер наблюдений, когда у вас на экране 4-и камеры выводит одновременно. Можете вывести четыре и больше приложений, поделить экран, разместить и наблюдать, работать благодаря разрешению 4К. Правда придется сесть по ближе к монитору. В общем буду изучать дальше, если возникнут вопросы перед покупкой, пишите, постараюсь ответить. Так же смотрите #мояраспаковка."
"4","Хороший не дорогой 4К монитор с солидной диагональю. Картинка смотрится отлично. После мака немного тускловат, но за счет обилия настроек изображение можно отрегулировать под любые глаза. Радует наличие 3 портов для подключения источника сигнала + такие фишки, как ""картинка в картинке"". Очень удобно подключить стационарник и ноутбук и работать на одном экране. Очень удобно сделана навигация по меню. Из минусов: монитор пришел с группкой битых пикселей в нижней части матрицы - это практически незаметно, но команда розетки могла бы и протестировать его перед отправкой. Отправлять обратно не стал т.к. это очень запарное дело. Если пиксели будут расти, тогда отдам в сервисный центр. Из пожеланий: все-таки хотелось бы 144 ГГц."
"4","Всё классно,но мне попался не удачный экземпляр,брал 23,03,2016-а сегодня отдал в сервис на замену матрицы."
"3","Восхитительная цена как для 4К, если бы только не такие гигантские размеры, как для настольного монитора в сочетании в мутной матрицей..."
"5","Гарний, чудовий, дуже задоволений монітором, адже захист зору відчуваю, у кого робота звязана з компютерами, люди не жалійте грошей, здоров'я важливіше."
"5","Доволен"
"5","До цього у мене десять років була Самсунгівська сімнашка. Уже давно хотів замінити її на щось сучасніше, але вона, сволота, продовжувала ідеально працювати. Врешті решт не витримав і прибрав її в коробку, сподіваюся новий монітор пропрацює не менше. Перехід від 17-ти дюймів, одразу аж до 28-и, звичайно справляє неабияке враження, монітор видається просто величезним. При цьому у нього іще й кількість пікселів на дюйм вдічі більша. Але з цим як раз найбільше проблем. Довелося виставити в налаштуваннях операційної системи збільшення 200% інакше усе виглядало дуже дрібним. При такому масштабі об'єкти на екрані виглядають приблизно такими ж як і на старому моніторі (там я ставив збільшення 125%). Тим, хто любить стандартний масштаб 100%, варто пошукати монітор з такою ж роздільною здатністю але на 23 дюйми. Ставити масштаб менше 200% не варто, бо тоді старі програми, які не вміють себе масштабувати, будуть виглядати розмитими. У мене вони чіткі, але ""зернисті"", наче хтось взяв скріншот, і розтягнув його у фотошопі в два рази по висоті й ширині. Сучасні ігри виглядають просто чудово (Відьмак 2, Skyforge), а ось старі доводиться запускати з роздільною здатністю FullHD, інакше елементи інтерфейсу будуть надто дрібні. Іще одна дрібниця, яка мене розчарувала це те, що не усі відеокарти AMD підтримують технологію FreeSync. Причому в деяких молодших моделях підтримка є, а у середніх - немає."
